{"design":{"campaign_exhaustion_tail":0.05,"confidence_level":0.95,"confidence_method":"wilson_score_one_sided","optional_stopping":false,"resampling_unit":"valid_statistical_sample","valid_statistical_samples":876},"derivation":{"campaign_reserve_cdf":0.9572735260468695,"observed_rate":0.07526881720430108,"per_entry_exhaustion_union_bound":0.036772082465398814,"wilson_upper_bound":0.13323024417735865},"observation":{"campaign_id":"campaign-8.0.2-se-confirmatory-2c398c97-37ed0b7e-20260824T103315","matching_failures":7,"transport_attempts":93},"policy_id":"confirmatory-apparatus-retry-d18-v1","recoverable_failure":{"complete_result":false,"message_contract":"incomplete_item.started_command_execution","protocol_error_kind":"malformed_record","refusal":false,"terminal_status":"protocol_error","timeout":false,"treatment_error":null,"usage_records":"empty"},"request_budget":{"apparatus_attempt_reserve":156,"calibration_attempt_ceiling":128,"calibration_request_count":64,"execute_request_ceiling":1032,"model_grade_request_ceiling":1160,"probe_attempt_ceiling":12,"probe_request_count":6,"provider_request_ceiling":2204,"reviewer_ceiling":0,"valid_statistical_samples":876},"runner_attempt_policy":{"backoff_seconds":0,"max_attempts":5,"retryable_apparatus_classes":["official_transient"]},"schema_version":"model-evolution-apparatus-retry-policy/1","scope":{"roles":["target_current","target_prior","target_holdout"],"skills":["long-document-segmented-writing","skill-evaluator","software-quality-workflows","writing-plans"],"treatments":"all_registered_treatments"}}
